{
  "applicationId": "SA-2026-000204",
  "submittedAt": "2026-09-20T16:48:12Z",
  "account": {
    "legalName": "Northwind Provisions Inc",
    "dbaName": "Northwind Market",
    "taxId": "900778899",
    "entityType": "CORP",
    "mcc": "5411",
    "incorporationDate": "2014-03-15",
    "phone": "(206) 555-0110",
    "salesRepId": "REP-0042",
    "leadSource": "Partner Referral",
    "address": {
      "line1": "455 Pine St",
      "city": "Seattle",
      "state": "WA",
      "postalCode": "98101"
    }
  },
  "owners": [
    { "firstName": "Dana", "lastName": "Whitfield", "title": "CEO", "ownershipPercent": 0.5, "ssn": "900-10-2020", "dateOfBirth": "1970-01-30", "email": "dana@northwind.example" },
    { "firstName": "Luis", "lastName": "Ortega", "title": "CFO", "ownershipPercent": 0.3, "ssn": "900-30-4040", "dateOfBirth": "1976-05-09", "email": "luis@northwind.example" },
    { "firstName": "Ken", "lastName": "Sato", "title": "COO", "ownershipPercent": 0.2, "ssn": "900-50-6060", "dateOfBirth": "1983-12-17", "email": "ken@northwind.example" }
  ],
  "processing": {
    "annualCardVolume": 3000000,
    "averageTicket": 42.1,
    "cardPresentPercent": 80,
    "motoPercent": 0,
    "ecommPercent": 20
  },
  "bank": {
    "routingNumber": "125000024",
    "accountNumber": "009988776655"
  }
}
